{
  "schema": "dbd-scn-0.1",
  "board": "DBD-157-v1",
  "standardsToWin": 5,
  "terrain": {},
  "units": [
    {
      "id": "B_DC_INF_1",
      "side": "BLUE",
      "type": "INF",
      "quality": "REGULAR",
      "hp": 4,
      "hex": 110
    },
    {
      "id": "B_DC_INF_2",
      "side": "BLUE",
      "type": "INF",
      "quality": "VETERAN",
      "hp": 4,
      "hex": 111
    },
    {
      "id": "B_DC_INF_3",
      "side": "BLUE",
      "type": "INF",
      "quality": "REGULAR",
      "hp": 4,
      "hex": 112
    },
    {
      "id": "B_DC_INF_4",
      "side": "BLUE",
      "type": "INF",
      "quality": "VETERAN",
      "hp": 4,
      "hex": 126
    },
    {
      "id": "B_DC_INF_5",
      "side": "BLUE",
      "type": "INF",
      "quality": "REGULAR",
      "hp": 4,
      "hex": 140
    },
    {
      "id": "B_DC_CAV_L",
      "side": "BLUE",
      "type": "CAV",
      "quality": "REGULAR",
      "hp": 3,
      "hex": 121
    },
    {
      "id": "B_DC_CAV_R",
      "side": "BLUE",
      "type": "CAV",
      "quality": "REGULAR",
      "hp": 3,
      "hex": 131
    },
    {
      "id": "B_DC_SKR_1",
      "side": "BLUE",
      "type": "SKR",
      "quality": "GREEN",
      "hp": 2,
      "hex": 95
    },
    {
      "id": "B_DC_ARC_1",
      "side": "BLUE",
      "type": "ARC",
      "quality": "GREEN",
      "hp": 2,
      "hex": 138
    },
    {
      "id": "B_DC_GEN_1",
      "side": "BLUE",
      "type": "GEN",
      "quality": "VETERAN",
      "hp": 4,
      "hex": 142
    },
    {
      "id": "R_DC_INF_1",
      "side": "RED",
      "type": "INF",
      "quality": "GREEN",
      "hp": 4,
      "hex": 42
    },
    {
      "id": "R_DC_INF_2",
      "side": "RED",
      "type": "INF",
      "quality": "REGULAR",
      "hp": 4,
      "hex": 43
    },
    {
      "id": "R_DC_INF_3",
      "side": "RED",
      "type": "INF",
      "quality": "REGULAR",
      "hp": 4,
      "hex": 44
    },
    {
      "id": "R_DC_INF_4",
      "side": "RED",
      "type": "INF",
      "quality": "VETERAN",
      "hp": 4,
      "hex": 45
    },
    {
      "id": "R_DC_INF_5",
      "side": "RED",
      "type": "INF",
      "quality": "REGULAR",
      "hp": 4,
      "hex": 46
    },
    {
      "id": "R_DC_INF_6",
      "side": "RED",
      "type": "INF",
      "quality": "REGULAR",
      "hp": 4,
      "hex": 47
    },
    {
      "id": "R_DC_INF_7",
      "side": "RED",
      "type": "INF",
      "quality": "GREEN",
      "hp": 4,
      "hex": 48
    },
    {
      "id": "R_DC_CAV_L",
      "side": "RED",
      "type": "CAV",
      "quality": "REGULAR",
      "hp": 3,
      "hex": 25
    },
    {
      "id": "R_DC_CAV_R",
      "side": "RED",
      "type": "CAV",
      "quality": "REGULAR",
      "hp": 3,
      "hex": 35
    },
    {
      "id": "R_DC_ARC_1",
      "side": "RED",
      "type": "ARC",
      "quality": "GREEN",
      "hp": 2,
      "hex": 30
    },
    {
      "id": "R_DC_SKR_1",
      "side": "RED",
      "type": "SKR",
      "quality": "GREEN",
      "hp": 2,
      "hex": 31
    },
    {
      "id": "R_DC_GEN_1",
      "side": "RED",
      "type": "GEN",
      "quality": "VETERAN",
      "hp": 4,
      "hex": 16
    }
  ],
  "turn": {
    "side": "BLUE",
    "turnNumber": 1,
    "activationsLeft": 3
  },
  "meta": {
    "id": "deep_center",
    "label": "Deep Center vs Thin Line"
  }
}
