{
  "schema": "dbd-scn-0.1",
  "board": "DBD-157-v1",
  "standardsToWin": 5,
  "terrain": {},
  "units": [
    {
      "id": "B_INF_1",
      "side": "BLUE",
      "type": "INF",
      "quality": "REGULAR",
      "hp": 4,
      "hex": 108
    },
    {
      "id": "R_INF_1",
      "side": "RED",
      "type": "INF",
      "quality": "REGULAR",
      "hp": 4,
      "hex": 44
    },
    {
      "id": "B_INF_2",
      "side": "BLUE",
      "type": "INF",
      "quality": "REGULAR",
      "hp": 4,
      "hex": 109
    },
    {
      "id": "R_INF_2",
      "side": "RED",
      "type": "INF",
      "quality": "REGULAR",
      "hp": 4,
      "hex": 45
    },
    {
      "id": "B_INF_3",
      "side": "BLUE",
      "type": "INF",
      "quality": "VETERAN",
      "hp": 4,
      "hex": 110
    },
    {
      "id": "R_INF_3",
      "side": "RED",
      "type": "INF",
      "quality": "VETERAN",
      "hp": 4,
      "hex": 46
    },
    {
      "id": "B_INF_4",
      "side": "BLUE",
      "type": "INF",
      "quality": "REGULAR",
      "hp": 4,
      "hex": 111
    },
    {
      "id": "R_INF_4",
      "side": "RED",
      "type": "INF",
      "quality": "REGULAR",
      "hp": 4,
      "hex": 47
    },
    {
      "id": "B_INF_5",
      "side": "BLUE",
      "type": "INF",
      "quality": "REGULAR",
      "hp": 4,
      "hex": 112
    },
    {
      "id": "R_INF_5",
      "side": "RED",
      "type": "INF",
      "quality": "REGULAR",
      "hp": 4,
      "hex": 48
    },
    {
      "id": "B_CAV_L1",
      "side": "BLUE",
      "type": "CAV",
      "quality": "VETERAN",
      "hp": 3,
      "hex": 104
    },
    {
      "id": "R_CAV_L1",
      "side": "RED",
      "type": "CAV",
      "quality": "VETERAN",
      "hp": 3,
      "hex": 40
    },
    {
      "id": "B_CAV_L2",
      "side": "BLUE",
      "type": "CAV",
      "quality": "REGULAR",
      "hp": 3,
      "hex": 120
    },
    {
      "id": "R_CAV_L2",
      "side": "RED",
      "type": "CAV",
      "quality": "REGULAR",
      "hp": 3,
      "hex": 27
    },
    {
      "id": "B_CAV_R1",
      "side": "BLUE",
      "type": "CAV",
      "quality": "VETERAN",
      "hp": 3,
      "hex": 116
    },
    {
      "id": "R_CAV_R1",
      "side": "RED",
      "type": "CAV",
      "quality": "VETERAN",
      "hp": 3,
      "hex": 52
    },
    {
      "id": "B_CAV_R2",
      "side": "BLUE",
      "type": "CAV",
      "quality": "REGULAR",
      "hp": 3,
      "hex": 130
    },
    {
      "id": "R_CAV_R2",
      "side": "RED",
      "type": "CAV",
      "quality": "REGULAR",
      "hp": 3,
      "hex": 37
    },
    {
      "id": "B_SKR_1",
      "side": "BLUE",
      "type": "SKR",
      "quality": "GREEN",
      "hp": 2,
      "hex": 93
    },
    {
      "id": "R_SKR_1",
      "side": "RED",
      "type": "SKR",
      "quality": "GREEN",
      "hp": 2,
      "hex": 60
    },
    {
      "id": "B_SKR_2",
      "side": "BLUE",
      "type": "SKR",
      "quality": "GREEN",
      "hp": 2,
      "hex": 94
    },
    {
      "id": "R_SKR_2",
      "side": "RED",
      "type": "SKR",
      "quality": "GREEN",
      "hp": 2,
      "hex": 61
    },
    {
      "id": "B_SKR_3",
      "side": "BLUE",
      "type": "SKR",
      "quality": "GREEN",
      "hp": 2,
      "hex": 95
    },
    {
      "id": "R_SKR_3",
      "side": "RED",
      "type": "SKR",
      "quality": "GREEN",
      "hp": 2,
      "hex": 62
    },
    {
      "id": "B_SKR_4",
      "side": "BLUE",
      "type": "SKR",
      "quality": "GREEN",
      "hp": 2,
      "hex": 96
    },
    {
      "id": "R_SKR_4",
      "side": "RED",
      "type": "SKR",
      "quality": "GREEN",
      "hp": 2,
      "hex": 63
    },
    {
      "id": "B_ARC_1",
      "side": "BLUE",
      "type": "ARC",
      "quality": "REGULAR",
      "hp": 2,
      "hex": 124
    },
    {
      "id": "R_ARC_1",
      "side": "RED",
      "type": "ARC",
      "quality": "REGULAR",
      "hp": 2,
      "hex": 31
    },
    {
      "id": "B_ARC_2",
      "side": "BLUE",
      "type": "ARC",
      "quality": "REGULAR",
      "hp": 2,
      "hex": 125
    },
    {
      "id": "R_ARC_2",
      "side": "RED",
      "type": "ARC",
      "quality": "REGULAR",
      "hp": 2,
      "hex": 32
    },
    {
      "id": "B_GEN_1",
      "side": "BLUE",
      "type": "GEN",
      "quality": "VETERAN",
      "hp": 4,
      "hex": 139
    },
    {
      "id": "R_GEN_1",
      "side": "RED",
      "type": "GEN",
      "quality": "VETERAN",
      "hp": 4,
      "hex": 19
    }
  ],
  "turn": {
    "side": "BLUE",
    "turnNumber": 1,
    "activationsLeft": 3
  },
  "meta": {
    "id": "symmetric_wings",
    "label": "Sym: Heavy Wings"
  }
}
