{
  "schema": "dbd-scn-0.1",
  "board": "DBD-157-v1",
  "standardsToWin": 5,
  "terrain": {},
  "units": [
    {
      "id": "B_RF_INF_1",
      "side": "BLUE",
      "type": "INF",
      "quality": "GREEN",
      "hp": 4,
      "hex": 136
    },
    {
      "id": "B_RF_INF_2",
      "side": "BLUE",
      "type": "INF",
      "quality": "REGULAR",
      "hp": 4,
      "hex": 137
    },
    {
      "id": "B_RF_INF_3",
      "side": "BLUE",
      "type": "INF",
      "quality": "REGULAR",
      "hp": 4,
      "hex": 124
    },
    {
      "id": "B_RF_INF_4",
      "side": "BLUE",
      "type": "INF",
      "quality": "VETERAN",
      "hp": 4,
      "hex": 125
    },
    {
      "id": "B_RF_INF_5",
      "side": "BLUE",
      "type": "INF",
      "quality": "REGULAR",
      "hp": 4,
      "hex": 126
    },
    {
      "id": "B_RF_INF_6",
      "side": "BLUE",
      "type": "INF",
      "quality": "REGULAR",
      "hp": 4,
      "hex": 113
    },
    {
      "id": "B_RF_CAV_1",
      "side": "BLUE",
      "type": "CAV",
      "quality": "VETERAN",
      "hp": 3,
      "hex": 116
    },
    {
      "id": "B_RF_CAV_2",
      "side": "BLUE",
      "type": "CAV",
      "quality": "REGULAR",
      "hp": 3,
      "hex": 130
    },
    {
      "id": "B_RF_SKR_1",
      "side": "BLUE",
      "type": "SKR",
      "quality": "GREEN",
      "hp": 2,
      "hex": 112
    },
    {
      "id": "B_RF_ARC_1",
      "side": "BLUE",
      "type": "ARC",
      "quality": "GREEN",
      "hp": 2,
      "hex": 152
    },
    {
      "id": "B_RF_GEN_1",
      "side": "BLUE",
      "type": "GEN",
      "quality": "VETERAN",
      "hp": 4,
      "hex": 153
    },
    {
      "id": "R_RF_INF_1",
      "side": "RED",
      "type": "INF",
      "quality": "GREEN",
      "hp": 4,
      "hex": 42
    },
    {
      "id": "R_RF_INF_2",
      "side": "RED",
      "type": "INF",
      "quality": "REGULAR",
      "hp": 4,
      "hex": 43
    },
    {
      "id": "R_RF_INF_3",
      "side": "RED",
      "type": "INF",
      "quality": "VETERAN",
      "hp": 4,
      "hex": 44
    },
    {
      "id": "R_RF_INF_4",
      "side": "RED",
      "type": "INF",
      "quality": "REGULAR",
      "hp": 4,
      "hex": 45
    },
    {
      "id": "R_RF_INF_5",
      "side": "RED",
      "type": "INF",
      "quality": "REGULAR",
      "hp": 4,
      "hex": 46
    },
    {
      "id": "R_RF_INF_6",
      "side": "RED",
      "type": "INF",
      "quality": "GREEN",
      "hp": 4,
      "hex": 47
    },
    {
      "id": "R_RF_CAV_1",
      "side": "RED",
      "type": "CAV",
      "quality": "VETERAN",
      "hp": 3,
      "hex": 40
    },
    {
      "id": "R_RF_CAV_2",
      "side": "RED",
      "type": "CAV",
      "quality": "REGULAR",
      "hp": 3,
      "hex": 57
    },
    {
      "id": "R_RF_SKR_1",
      "side": "RED",
      "type": "SKR",
      "quality": "GREEN",
      "hp": 2,
      "hex": 30
    },
    {
      "id": "R_RF_ARC_1",
      "side": "RED",
      "type": "ARC",
      "quality": "GREEN",
      "hp": 2,
      "hex": 31
    },
    {
      "id": "R_RF_GEN_1",
      "side": "RED",
      "type": "GEN",
      "quality": "VETERAN",
      "hp": 4,
      "hex": 16
    }
  ],
  "turn": {
    "side": "BLUE",
    "turnNumber": 1,
    "activationsLeft": 3
  },
  "meta": {
    "id": "refused_flank",
    "label": "Refused Flank"
  }
}
